{
  "$schema": "../../../../schemas/agent.schema.json",
  "schemaVersion": 1,
  "catalogTier": "experimental",
  "id": "workplace-content-pack",
  "riskLevel": "Low",
  "permissions": [
    "Read the skill instructions and reference files",
    "Write output only when the user requests it"
  ],
  "risks": [
    "Agent behavior depends on the host and the information supplied in a prompt."
  ],
  "requirements": [
    "An Agent Skills compatible host; host loading has not been tested"
  ],
  "compatibility": [
    {
      "target": "agent-skills",
      "status": "unverified",
      "notes": "Format appears compatible; host-specific loading has not been tested."
    }
  ],
  "name": "Workplace Content Pack",
  "icon": "WP",
  "description": "Internal writing guidance and visual themes bundled as two independent skills.",
  "highlights": [
    "2 skills",
    "Writing",
    "Design themes"
  ],
  "capabilities": [
    "documents"
  ],
  "license": "Apache-2.0",
  "source": {
    "url": "https://github.com/anthropics/skills/tree/34040c9c568585f6929bedeaad110ad08f079624/skills",
    "revision": "34040c9c568585f6929bedeaad110ad08f079624"
  },
  "tags": [
    "Pack",
    "Writing",
    "Design"
  ],
  "contents": [
    {
      "path": "README.md",
      "kind": "doc"
    },
    {
      "path": "skills/internal-comms/SKILL.md",
      "kind": "skill"
    },
    {
      "path": "skills/internal-comms/LICENSE.txt",
      "kind": "doc"
    },
    {
      "path": "skills/internal-comms/examples",
      "kind": "doc"
    },
    {
      "path": "skills/theme-factory/SKILL.md",
      "kind": "skill"
    },
    {
      "path": "skills/theme-factory/LICENSE.txt",
      "kind": "doc"
    },
    {
      "path": "skills/theme-factory/themes",
      "kind": "doc"
    },
    {
      "path": "skills/theme-factory/theme-showcase.pdf",
      "kind": "asset"
    }
  ],
  "maintainer": {
    "name": "Unassigned",
    "team": "Evaluation",
    "initials": "—",
    "email": "unassigned@example.invalid"
  },
  "updatedAt": "2026-09-24",
  "status": "evaluation",
  "review": {
    "status": "reviewed",
    "date": "2026-09-24",
    "version": "1.0.0",
    "evidence": "docs/AGENT_SOURCE_REVIEW.md"
  },
  "currentVersion": "1.0.0"
}
