{
  "$schema": "../../../../schemas/agent.schema.json",
  "schemaVersion": 1,
  "catalogTier": "experimental",
  "id": "theme-factory",
  "riskLevel": "Low",
  "permissions": [
    "Read the skill instructions and reference files",
    "Write output only when the user requests it"
  ],
  "risks": [
    "Agent behavior depends on the host and the information supplied in a prompt."
  ],
  "requirements": [
    "An Agent Skills compatible host; host loading has not been tested"
  ],
  "compatibility": [
    {
      "target": "agent-skills",
      "status": "unverified",
      "notes": "Format appears compatible; host-specific loading has not been tested."
    }
  ],
  "name": "Theme Factory",
  "icon": "TF",
  "description": "Ten color and font themes for presentations, documents, and other visual work.",
  "highlights": [
    "Design themes",
    "Color palettes",
    "Typography"
  ],
  "capabilities": [
    "documents"
  ],
  "license": "Apache-2.0",
  "source": {
    "url": "https://github.com/anthropics/skills/tree/34040c9c568585f6929bedeaad110ad08f079624/skills/theme-factory",
    "revision": "34040c9c568585f6929bedeaad110ad08f079624"
  },
  "tags": [
    "Anthropic",
    "Skill",
    "Design"
  ],
  "install": {
    "unpack": {
      "project": ".agents/skills/theme-factory",
      "global": "~/.agents/skills/theme-factory"
    }
  },
  "contents": [
    {
      "path": "SKILL.md",
      "kind": "skill"
    },
    {
      "path": "LICENSE.txt",
      "kind": "doc"
    },
    {
      "path": "themes",
      "kind": "doc"
    },
    {
      "path": "theme-showcase.pdf",
      "kind": "asset"
    }
  ],
  "maintainer": {
    "name": "Unassigned",
    "team": "Evaluation",
    "initials": "—",
    "email": "unassigned@example.invalid"
  },
  "updatedAt": "2026-09-24",
  "status": "evaluation",
  "review": {
    "status": "reviewed",
    "date": "2026-09-24",
    "version": "1.0.0",
    "evidence": "docs/AGENT_SOURCE_REVIEW.md"
  },
  "currentVersion": "1.0.0"
}
