{
  "$schema": "../../../../schemas/agent.schema.json",
  "schemaVersion": 1,
  "catalogTier": "experimental",
  "id": "anthropic-pdf",
  "name": "PDF Skill",
  "icon": "PDF",
  "description": "Extract text, fill forms, and process scanned PDF documents.",
  "highlights": ["Text extraction", "Forms", "OCR"],
  "riskLevel": "Unknown",
  "permissions": [
    "Read local PDF files supplied by the user",
    "Write generated or modified PDF files to the working directory",
    "Run bundled Python and command-line helpers on the local machine"
  ],
  "risks": [
    "Scripts can read and rewrite files in the project or skills directory.",
    "OCR and form-filling helpers may invoke local Python packages."
  ],
  "contents": [
    {
      "path": "SKILL.md",
      "kind": "skill",
      "note": "When to use the skill and the core PDF workflow."
    },
    {
      "path": "forms.md",
      "kind": "doc",
      "note": "Form-filling instructions."
    },
    {
      "path": "reference.md",
      "kind": "doc",
      "note": "Advanced libraries and troubleshooting."
    },
    {
      "path": "scripts",
      "kind": "script",
      "note": "Python helpers for extract, merge, split, and related tasks."
    },
    {
      "path": "LICENSE.txt",
      "kind": "doc",
      "note": "Source-available license terms for this document skill."
    }
  ],
  "maintainer": {
    "name": "Unassigned",
    "team": "Owner needed",
    "initials": "\u2014",
    "email": "unassigned@example.invalid"
  },
  "tags": [
    "Anthropic",
    "Skill",
    "PDF",
    "Documents"
  ],
  "updatedAt": "2026-09-23",
  "status": "example",
  "review": {
    "status": "pending"
  },
  "capabilities": [
    "documents"
  ],
  "requirements": [
    "Python and PDF utilities; exact versions need verification"
  ],
  "compatibility": [
    {
      "target": "agent-skills",
      "status": "unverified",
      "notes": "Illustrative target only. No compatibility test has been recorded."
    }
  ]
}
